{
  "schema": "afi.provider-strategy-binding.v1",
  "bindingId": "oracle-no-default-webhook",
  "providerId": "oracle-provider-nodefault",
  "providerType": "webhook",
  "authenticatedBy": "route-secret",
  "allowedStrategies": [
    {
      "analystId": "froggy",
      "strategyId": "trend_pullback_v1",
      "strategyVersion": "1.0.0"
    }
  ],
  "status": "active"
}
